<?xml version="1.0" encoding="UTF-8"?>
<data xmlns="http://www.woltlab.com" xmlns:xsi="http://www.w3.org/2001/XMLSchema-instance" xsi:schemaLocation="http://www.woltlab.com http://www.woltlab.com/XSD/6.0/clipboardAction.xsd">
	<import>
		<!-- com.woltlab.wcf.media -->
		<action name="insert">
			<actionclassname>wcf\system\clipboard\action\MediaClipboardAction</actionclassname>
			<showorder>1</showorder>
			<pages>
				<page>menuManagerDialog-editor</page>
			</pages>
		</action>
		<action name="delete">
			<actionclassname>wcf\system\clipboard\action\MediaClipboardAction</actionclassname>
			<showorder>2</showorder>
			<pages>
				<page>menuManagerDialog-editor</page>
				<page>menuManagerDialog-select</page>
			</pages>
		</action>
		<action name="setCategory">
			<actionclassname>wcf\system\clipboard\action\MediaClipboardAction</actionclassname>
			<showorder>3</showorder>
			<pages>
				<page>menuManagerDialog-editor</page>
				<page>menuManagerDialog-select</page>
			</pages>
		</action>
		<!-- /com.woltlab.wcf.media -->
	</import>
	<delete>
		<!-- com.woltlab.wcf.user -->
		<action name="assignToGroup">
			<actionclassname>wcf\system\clipboard\action\UserClipboardAction</actionclassname>
			<showorder>1</showorder>
			<pages>
				<page>wcf\acp\page\UserListPage</page>
			</pages>
		</action>
		<action name="delete">
			<actionclassname>wcf\system\clipboard\action\UserClipboardAction</actionclassname>
			<showorder>2</showorder>
			<pages>
				<page>wcf\acp\page\UserListPage</page>
			</pages>
		</action>
		<action name="deleteUserContent">
			<actionclassname>wcf\system\clipboard\action\UserClipboardAction</actionclassname>
			<showorder>3</showorder>
			<pages>
				<page>wcf\acp\page\UserListPage</page>
			</pages>
		</action>
		<action name="ban">
			<actionclassname>wcf\system\clipboard\action\UserClipboardAction</actionclassname>
			<showorder>4</showorder>
			<pages>
				<page>wcf\acp\page\UserListPage</page>
			</pages>
		</action>
		<action name="merge">
			<actionclassname>wcf\system\clipboard\action\UserClipboardAction</actionclassname>
			<showorder>5</showorder>
			<pages>
				<page>wcf\acp\page\UserListPage</page>
			</pages>
		</action>
		<action name="enable">
			<actionclassname>wcf\system\clipboard\action\UserClipboardAction</actionclassname>
			<showorder>6</showorder>
			<pages>
				<page>wcf\acp\page\UserListPage</page>
			</pages>
		</action>
		<action name="confirmEmail">
			<actionclassname>wcf\system\clipboard\action\UserClipboardAction</actionclassname>
			<showorder>7</showorder>
			<pages>
				<page>wcf\acp\page\UserListPage</page>
			</pages>
		</action>
		<action name="unconfirmEmail">
			<actionclassname>wcf\system\clipboard\action\UserClipboardAction</actionclassname>
			<showorder>8</showorder>
			<pages>
				<page>wcf\acp\page\UserListPage</page>
			</pages>
		</action>
		<action name="resendActivationMail">
			<actionclassname>wcf\system\clipboard\action\UserClipboardAction</actionclassname>
			<showorder>9</showorder>
			<pages>
				<page>wcf\acp\page\UserListPage</page>
			</pages>
		</action>
		<action name="sendMail">
			<actionclassname>wcf\system\clipboard\action\UserClipboardAction</actionclassname>
			<showorder>10</showorder>
			<pages>
				<page>wcf\acp\page\UserListPage</page>
			</pages>
		</action>
		<action name="exportMailAddress">
			<actionclassname>wcf\system\clipboard\action\UserClipboardAction</actionclassname>
			<showorder>11</showorder>
			<pages>
				<page>wcf\acp\page\UserListPage</page>
			</pages>
		</action>
		<action name="sendNewPassword">
			<actionclassname>wcf\system\clipboard\action\UserClipboardAction</actionclassname>
			<showorder>12</showorder>
			<pages>
				<page>wcf\acp\page\UserListPage</page>
			</pages>
		</action>
		<action name="revertContentChanges">
			<actionclassname>wcf\system\clipboard\action\UserContentClipboardAction</actionclassname>
			<showorder>13</showorder>
			<pages>
				<page>wcf\acp\page\UserListPage</page>
			</pages>
		</action>
		<!-- /com.woltlab.wcf.user -->
		<!-- com.woltlab.wcf.article -->
		<action name="trash">
			<actionclassname>wcf\system\clipboard\action\ArticleClipboardAction</actionclassname>
			<showorder>1</showorder>
			<pages>
				<page>wcf\acp\page\ArticleListPage</page>
			</pages>
		</action>
		<action name="delete">
			<actionclassname>wcf\system\clipboard\action\ArticleClipboardAction</actionclassname>
			<showorder>2</showorder>
			<pages>
				<page>wcf\acp\page\ArticleListPage</page>
			</pages>
		</action>
		<action name="restore">
			<actionclassname>wcf\system\clipboard\action\ArticleClipboardAction</actionclassname>
			<showorder>3</showorder>
			<pages>
				<page>wcf\acp\page\ArticleListPage</page>
			</pages>
		</action>
		<action name="unpublish">
			<actionclassname>wcf\system\clipboard\action\ArticleClipboardAction</actionclassname>
			<showorder>4</showorder>
			<pages>
				<page>wcf\acp\page\ArticleListPage</page>
			</pages>
		</action>
		<action name="publish">
			<actionclassname>wcf\system\clipboard\action\ArticleClipboardAction</actionclassname>
			<showorder>5</showorder>
			<pages>
				<page>wcf\acp\page\ArticleListPage</page>
			</pages>
		</action>
		<action name="setCategory">
			<actionclassname>wcf\system\clipboard\action\ArticleClipboardAction</actionclassname>
			<showorder>6</showorder>
			<pages>
				<page>wcf\acp\page\ArticleListPage</page>
			</pages>
		</action>
		<!-- com.woltlab.wcf.tag -->
		<action name="delete">
			<actionclassname>wcf\system\clipboard\action\TagClipboardAction</actionclassname>
			<showorder>1</showorder>
			<pages>
				<page>wcf\acp\page\TagListPage</page>
			</pages>
		</action>
		<action name="setAsSynonyms">
			<actionclassname>wcf\system\clipboard\action\TagClipboardAction</actionclassname>
			<showorder>2</showorder>
			<pages>
				<page>wcf\acp\page\TagListPage</page>
			</pages>
		</action>
		<!-- com.woltlab.wcf.tag -->
		<action name="assignUserByClipboard">
			<actionclassname>wcf\system\clipboard\action\ModerationQueueClipboardAction</actionclassname>
			<showorder>1</showorder>
			<pages>
				<page>wcf\page\ModerationListPage</page>
			</pages>
		</action>
		<action name="enableContent">
			<actionclassname>wcf\system\clipboard\action\ModerationQueueActivationClipboardAction</actionclassname>
			<showorder>2</showorder>
			<pages>
				<page>wcf\page\ModerationListPage</page>
			</pages>
		</action>
		<action name="removeActivationContent">
			<actionclassname>wcf\system\clipboard\action\ModerationQueueActivationClipboardAction</actionclassname>
			<showorder>3</showorder>
			<pages>
				<page>wcf\page\ModerationListPage</page>
			</pages>
		</action>
		<action name="removeReport">
			<actionclassname>wcf\system\clipboard\action\ModerationQueueReportClipboardAction</actionclassname>
			<showorder>4</showorder>
			<pages>
				<page>wcf\page\ModerationListPage</page>
			</pages>
		</action>
		<action name="removeReportContent">
			<actionclassname>wcf\system\clipboard\action\ModerationQueueReportClipboardAction</actionclassname>
			<showorder>5</showorder>
			<pages>
				<page>wcf\page\ModerationListPage</page>
			</pages>
		</action>
	</delete>
</data>
